{
    "Group": "EMERGENCY PROCEDURES",
    "Images": [],
    "Name": "Retrograde",
    "ProjectName": "EmerRetrograde",
    "Side": 0,
    "SortPriority": 1020,
    "Spacecraft": 3,
    "Steps": [],
    "checklistText": "EMERGENCY PROCEDURES\n\nRETROGRADE\n\nIf the \"Retro Seq\" telelight fails to illuminate at retrograde\r\ntime, the retrograde sequence can be started by depressing the\r\nRetro Seq button or the Fire Retro button. Depressing\r\nthe Retro Seq button will start the normal retrograde\r\nsequence while depressing the Fire Retro button will fire the\r\nretrograde rockets. Use the Retro Att By-Pass switch to\r\nbypass correct retrograde during attitude failures.\r\n\r\nFAILURE TO ATTAIN RETROGRADE ATTITUDE\r\n1. Check attitude indicator and periscope to determine\r\n\tif capsule is in retrograde attitude.\r\n2. If capsule is in the retrograde attitude:\r\n\ta. Retro Att switch - BYPASS\r\n\tb. Fire Retro button - DEPRESS\r\n3.If the capsule is not in the retrograde attitude:\r\n\ta. Manual fuel handle - PUSH RATE COMD\r\n\tb. RSCS switch - RATE COMD\r\n\tc. ASCS switch - FLY-BY-WIRE\r\n\td. Use hand controller to position capsule in the\r\n\t\tretrograde attitude.\r\n\te. If attitude permission circuit is operating, the\r\n\t\tretrograde rockets will fire 30 seconds after\r\n\t\tinitiating retro sequence or as soon as the\r\n\t\tcapsule if in the retrograde attitude, if\r\n\t\tover 30 seconds.\r\n\r\nRETROGRADE PACKAGFE FAILS TO JETTISON\r\nThe retrograde package is jettisoned 60 seconds after retro\r\nfire is initiated.\r\nIf it fails:\r\n1. Jett Retro button - DEPRESS\r\n2. If Retrograde package does not jettison:\r\n\ta. Retro Jett fuse switch - NO. 2\r\n\tb. Emer Retro Jett fuse switch - NO.2\r\n3. Jett Retro button - DEPRESS\r\n\r\n\r\nASCS CANNOT MAINTAIN RE-ENTRY ATTITUDE\r\nIf ASCS does not reposition capsule to correct re-entry\r\nattitude when Attitude switch is set to RE-ENTRY:\r\n1. Manual fuel handle - PUSH RATE COMD\r\n2. RSCS switch - RATE COMD\r\n3. Retract Scope switch - MAN\r\n4. Use hand controller to position the capsule in the\r\n\tre-entry attitude.\r\n5. RSCS switch - AUTO\r\n6. Use periscope to see if ASCS will maintain re-entry\r\n\tattitude.\r\n7. If ASCS will maintain re-entry attitude:\r\n\tRetract Scope switch - AUTO.\r\n8. If ASCS will not maintain re-entry attitude:\r\n\ta. RSCS switch - RATE COMD\r\n\tb. As soon as the \".05g Switch\" telelight illuminates\r\n\t\tRetract Scope switch - AUTO.\r\n\tc. Check that RSCS initiates 7 degree/sec slow roll.\r\n\r\n\r\n"
}