{"Spacecraft":0,"ProjectName":"TnDCSMSep","Group":"T&D","Name":"CSM SEPARATION","Side":0,"SortPriority":603,"checklistText":"<size=21>CSM SEPARATION checklist</size>\r\nV49E\tF 06 22 (EXTRACT ATT)\ncb SECS LOGIC (2) - closed (verify)\ncb SECS ARM (2) - closed (verify)\nSECS LOGIC (2) - on (up)(verify)\nRCS CMD - ON\nSECS PYRO ARM (2) - ARM\nGDC ALIGN\nEMS FUNC - ΔV (verify)\nEMS MODE - NORMAL\n59:30\tStart DET\n59:50\tCMC MODE - AUTO\n59:58\tThurst +X and hold\n00:00\tCSM/LV SEP pb - push, hold, and release\n\tLV TANK PRESS - full scale low\n00:03\tTHC - release (ΔV .5 fps)\n\tSM RCS PRPLNT tb (8) - gray(verify)\n\tSM RCS He tb (8) - gray (verify)\n\tSM RCS SEC PRPLNT FUEL PRESS (4) - CLOSE\n\tFC REAC vlv - NORM","Steps":[],"Images":[]}