{
    "Group": "ORBITING",
    "Images": [],
    "Name": "CIRCULARIZE ORBIT",
    "ProjectName": "OrbitingCircOrbit",
    "Side": 0,
    "SortPriority": 32,
    "Spacecraft": 2,
    "Steps": [],
    "checklistText": "CIRCULARIZE ORBIT\nComputer:\n- Set Ap (core 57) and Pe (core 56) to your destination target.\n- Read time to Ap (core 73) and Pe (core 74)\n\nThe Hohmann Transfer:\nAt Apogee:\n- Burn so IVI's read zero\n\nAp Perigee:\n- Burn so IVI's read zero"
}