{
    "Group": "ACTIVATION",
    "Name": "Intravehicular Transfer",
    "ProjectName": "IntravehicularTransfer",
    "Side": 0,
    "SortPriority": 110,
    "Spacecraft": 1,
    "Steps": [],
    "Images": [],
    "checklistText": "<size=21>INITIAL INTRAVEHICULAR TRANSFER TO LM/CSM</size>\r\n\n1.\tCM/LM are docked\n2.\tEqualize the pressure using LM tunnel hatch\n3.\tOpen hatch using the Tools menu\n4.\tPress F4 to switch between the active spacecrafts.\n"
}