{
    "Group": "LUNAR DESCENT",
    "Name": "P66 - LANDING PHASE",
    "ProjectName": "PoweredDescentP66",
    "Side": 0,
    "SortPriority": 204,
    "Spacecraft": 1,
    "Steps": [],
    "Images": [],
    "checklistText": "LANDING PHASE (ROD) PROGRAM (P66)\r\n\r\n1.\tObserve PROG ind - 66\r\n\r\n2.\tFL V06 N60\r\n\t\tR1 V (Forward)\tXXXX.X fps\r\n\t\tR2 H rate\t\tXXXX.X fps\r\n\t\tR3 H\t\tXXXXX ft\r\n\r\n3.\tMonitor descent:\r\n\tDES RATE sw - effect desired rate of descent.\r\n\t\r\n\tINPUT SETTINGS:\r\n\tUse the bound ROD axis (pos/neg) to modify rate of descent.\r\n\r\n\tIf manual attitude control:\r\n\t\tACA:\r\n\t\t\tSet S/C: ATTITUDE CONT: PITCH to DIR\r\n\t\t\tMaintain ATTITUDE\r\n\r\n\r\n\t\t\tWARNING\r\n\r\n\t\tDES QTY warn lt will not be accompanies\r\n\t\tby MASTER ALARM; therefore, crewman must\r\n\t\tmonitor MPS: FUEL & OXID QUANTITY ind.\r\n\r\n4.\tMonitor CMD THRUST ind\r\n\r\n5.\tIf manual throttle control is desired:\r\n\tENG THR CONTR: THR CONT sw - MAN\r\n\tTTCA - move up until CMD THRUST ind - 20%, and null descent rate.\r\n\tContinue descent.\r\n\r\n6.\tWhen forward & alteral velocities <XX fps:\r\n\tVEL lt - on\r\n\tALT lt - on\r\n\r\n7.\tMonitor touchdown:\r\nPanel 1,3:\r\n\tLUNAR CONTACT lt - on\r\n\tEng STOP pb/lt - push\r\n\t(skip) Stand by to abort stage if:\r\n\t\tLM tilt angle >XX\u00c2\u00b0\r\n\t\tLM tilt angle changing at >X\u00c2\u00b0/sec\r\n\r\n8.\tAfter LM is stabilized:\r\n\tENG THR CONT: ENG ARM sw - OFF\r\nPanel 3:\r\n\tS/C: PGNS sw - ATT HOLD\r\n\tACA - out of detent to deactivate RCA thrusters if required\r\n\tRecord LM attitude\r\n\r\n\tKey PRO\r\n\t\r\n\tWhen Lunar-stay decision is made:\r\n\tKey V37E 68E\r\n\r\n\r\n\r\n"
}