{"Spacecraft":3,"ProjectName":"PrepPreFlight","Group":"PRE-FLIGHT","Name":"Pre-Flight","Side":0,"SortPriority":10,"checklistText":"1. All left panel fuses - NO. 1 POSITION\n2. Squib switch - OFF\n3. Auto retro jett switch - ARM\n4. ASCS switch - NORM\n5. RSCS switch - AUTO\n6. Gyro switch - GYRO NORM\n7. Manual fuel handle - PUSH IN\n8. Roll fuel handle - PUSH IN\n9. Yaw fuel handle - PUSH IN\n10. Pitch fuel handle - PUSH IN\n11. Retro delay switch - INST\n12. Photo lights switch - ON\n13. Cabin lights switch - BOTH\n14. TLM-LO freq switch - ON\n15. Rescue switch - AUTO\n16. Launch Contl switch - OFF\n17. Jett Tower Ring - IN\n18. Sep Capsule Ring - IN\n19. Retro Att switch - AUTO\n20. Fire Retro switch - GUARD\n21. Jett Retro switch - GUARD\n22. Snorkel Ring - IN\n23. Main Ring - IN\n24. Reserve Ring - IN\n25. Landing Bag switch - AUTO\n26. Control Fuel - CHECK\n      a. Auto Fuel - 100%\n      b. Manual Fuel - 100%\n27. Rate of Descent - 0 FT/SEC\n28. Altimeter - CHECK\n29. Satellite clock\n      a. Time of Day\n      b. Time from launch - ZERO\n      c. Time to Retrograde\n30. Attitude/Rate ind. - CHECK\n      a. Rate indicators - CENTER\n      b. Attitude indicators - CHECK\n31. Time Zero Cover - REMOVE\n32. Cabin pressure - CHECK\n33. Cabin Air temp - CHECK\n34. Suit Env. Indicator - CHECK\n35. Oxygen Qunatity - CHECK\n      a. Primary - 100%\n      b. Secondayr - 100%\n36. Suit Fan switch - NORM\n37. Cabin Fan switch - NORM\n38. DC Volts knob - MAIN\n39. ASCS AC Bus - NORM\n40. Stby Btry switch - ON\n41. Isol Btry switch - STBY\n42. Inlet Valve Pwr switch - NORM\n43. Audio Bus switch - NORM\n44. AC voltmeter: 150 VOLTS\n45. VOX Pwe switch - OFF\n46. UHF DF switch - NORM\n47. UHF select switch - HI PWR\n48. Transmit switch - OFF\n49. Beacon switch - GRND\n50. All Audio Tone switches - ON\n51. Warning Lights switch - BRIGHT\n52. All switch fuses - NO. 1 POSITION\n53. Emer O2 switch - NORM\n54. Suit Temp selector - TO MARK\n55. Cabin Temp selector - TO MARK\n56. Inverter Temp selector - TO MARK","Steps":[],"Images":[]}