{
  "Spacecraft": 0,
  "ProjectName": "Backup13VerifyCouchConfig",
  "Group": "BACKUP CREW PRELAUNCH",
  "Name": "VERIFY COUCH CONFIGURATION",
  "Side": 0,
  "SortPriority": 53,
  "checklistText": "VERIFY COUCH CONFIGURATION\r\n\r\n\tMDC assist bar – extd & locked\r\n\tHeadrests – soft suit position\r\n\tTHC armrest in launch position & locked\r\n\tIndb arm rests – stowed & contr locked\r\n\tCouches – launch/entry position (Y-Y\r\n\t\tstruts extd & locked)\r\n\tSeat pans - 85° position & locked\r\nO2/comm umb – stowed\r\nHarnesses & restraints – extd & laid aside\r\nCouch stab brace – stowed\r\nEgress CM\r\n\r\n\r\n\r\n\r\n",
  "Steps": [
    {
      "Program": 0,
      "Type": 0,
      "SetID": 0,
      "ToPosID": 0,
      "Text": "Toggle seats to normal launch config (visible)"
    }
  ],
  "Images": []
}