{
    "Group": "EPS",
    "Images": [],
    "Name": "Prepare DPS BURN",
    "ProjectName": "EPS_PrepDPSBurn",
    "Side": 1,
    "SortPriority": 1203,
    "Spacecraft": 1,
    "Steps": [],
    "checklistText": "<size=21>EPS PREPARATION FOR DPS BURN</size>\r\n\r\n1.\tPerform EPS Basic (Unstaged), except:\r\n\r\nPanel 11:\r\n\tCB EPS: INV 1 - close\r\n\r\nPanel 14:\r\n2.\tCheck a-c voltage from inverter No. 1:\r\n\tEPS:\r\n\t\tPOWER/TEMP MON sel - AC BUS\r\n\t\tINVERTER ew - 1\r\n\t\tVOLTS ind - green band\r\n\r\n\t\tCAUTION\r\n\r\n\tTwenty minutes before start of DPS burn,\r\n\tascent batteries must be placed on-line\r\n\tin parallel with descent batteries. CB\r\n\tEPS: CROSS TIE BAL LOADS (2) must remain\r\n\tclosed until just before start of burn.\r\n\r\n3.\tPlace both ascent batteries on line:\r\n\tEPS:\r\n\t\tPOWER/TEMP MON sel - BAT 5\r\n\t\tVOLTS ind - 31, 5 to 37.2 vdc\r\n\t\tAMPS ind - 0 amps\r\n\t\tBAT 5 NORMAL LMP FEED sw - ON; tb - gray\r\n\t\tVOLTS ind - 28.0 to 32.5 vdc\r\n\t\tAMPS ind - TBD\r\n\t\tPOWER/TEMP MON sel - BAT 6\r\n\t\tVOLTS ind - 31.5 to 37.2 vdc\r\n\t\tAMPS ind - 0 amps\r\n\t\tBAT 6 NORMAL CDR FEED sw - ON; tb - gray\r\n\t\tVOLTS ind - 28.0 to 32.5 vdc\r\n\t\tAMPS ind - TBD\r\n\r\nPanel 14:\r\n4.\tCheck voltage of all six batteries:\r\n\tEPS:\r\n\t\tPOWER/TEMP MON sel - BAT 1\r\n\t\tVOLTS ind - 28.0 to 32.5 vdc\r\n\t\tRepeat check for BAT 2, 3, 4, 5, & 6\r\n\r\n5.\tCheck d-c voltage on both buses:\r\n\tEPS:\r\n\t\tPOWER/TEMP MON sel - LMP BUS\r\n\t\tVOLTS ind - 26.5 to 32.5 vdc\r\n\r\n6.\tEPS: POWER/TEMP MON sel - CDR BUS\r\n\r\n"
}