{
    "Group": "SYSTEM CHECKS",
    "Images": [],
    "Name": "CABIN & SUIT PSI CHECK",
    "ProjectName": "SystemCabinSuitPSICheck",
    "Side": 1,
    "SortPriority": 1003,
    "Spacecraft": 0,
    "Steps": [],
    "checklistText": "<size=21>SYSTEMS & MONITORING CHECKS\nCabin and suit pressure check</size>\r\nIf cabin press >5.3:\r\n\t02 flow - 0.2 lb/hr\r\nIf 4.7 < cabin press < 5.3\r\n\tO2 flow - pegged lo or hi,  ~0.7 lb/hr stable\r\nEMERG CABIN PRESS vlv - BOTH\r\nSUIT CKT RET vlv - open (pull)\r\nRemove helmet and gloves and stow in PGA bag"
}