{"Spacecraft":0,"ProjectName":"TnDPostDocking","Group":"T&D","Name":"POST DOCKING","Side":0,"SortPriority":606,"checklistText":"<size=21>POST DOCKING checklist</size>\r\nRATE - HIGH\nATT DB - MAX\nCOAS - OFF\ncb RCS LOGIC (2) - open (verify)\nTVC SERVI PWR #1 - OFF\nEMS MODE - STBY\nEMS FUNC - OFF\nBMAG MODE (3) - RATE 2 (verify)\nLM PWR - OFF (verify)\nTUNNE LIGHTS - ON\n\n","Steps":[],"Images":[]}