{
  "Spacecraft": 0,
  "ProjectName": "Emer_Abort1B",
  "Group": "ABORT",
  "Name": "Abort Mode 1B",
  "Side": 0,
  "SortPriority": 9000002,
  "checklistText": "\t\tMode 1B LES Abort (00:42 - 01:56)\r\n\r\n\r\n\t1\tAbort initiation\t\t\tX\r\n\t\t\tauto or man\t\t\t\tX\r\n\t\t\t THC - CCW\t\t\t\tX\r\n\t\t\t\t\t\t\t\t\tX\r\n\tXXXXXXXXXXXXXXXXXXXXXXXXXXX\r\n\tX\r\n\tX\tCM/SM SEP (both) - on\r\n\tX\t (up)\r\n\tX\r\n\tXXXXXXXXXXXXXXXXXXXXXXXXXXX\r\n\t\t\t\t\t\t\t\t\tX\r\n\t\t\tBECO (auto)\t\t\t\tX Request grd\r\n\t\t\t\t\t\t\t\t\tX  cmd BECO\r\n\t\t\t\t\t\t\t\t\tX\r\n\t\tEvnt Tmr rset &\t\t\tX\r\n\t\t counting up (auto)\t\t\tX\r\n\t\t\t\t\t\t\t\t\tX\r\n\t\tCM/SM deadface (auto)\t\tX\r\n\t\t\t\t\t\t\t\t\tX\r\n\t\tSM C/W lts - on\t\t\t\tX\r\n\t\t\t\t\t\t\t\t\tX\r\n\t\tMASTER ALARM pb/lt -\t\tX\r\n\t\t\ton\t\t\t\t\t\tX\r\n\t\t\t\t\t\t\t\t\tX\r\n\t\tCM RCS press\t\t\t\tX\r\n\t\t\t(auto)\t\t\t\t\tX\r\n\t\tRCS cont trnfr (auto)\t\tX\r\n\t\t\t\t\t\t\t\t\tX\t\r\n00:00.1\t\tCM/SM sep (auto)\t\t\tX\r\n\t\t\t\t\t\t\t\t\tX\r\n\t\tLE motor fire  (auto)\t\tX\r\n\t\t\t\t\t\t\t\t\tX\r\n00:01\t\tSCS/RCS enbl (auto)\t\tX\r\n\t\t\t\t\t\t\t\t\tX\r\n00:01.8\t\tCM/SM sep pyro dead-\tX\r\n\t\t face (auto)\t\t\t\t\tX\r\n\t\t\t\t\t\t\t\t\tX\r\n\tXXXXXXXXXXXXXXXXXXXXXXXXXXX\r\n\tX\r\n00:05X If abort init with\r\n\tX  CM/SM SEP (both) or\r\n\tX  BU req for any auto\r\n\tX  evnt\r\n\tX\r\n\tX\tEVNT TMR RSET - RSET\r\n\tX\r\n\tX\tEVNT TMR START - START\r\n\tX\r\n\tX\tCM RCS PRESS - on (up)\r\n\tX\r\n\tX\tRCS TRNFR - CM\r\n\tX\r\n\tX\tLES MOT FIRE pb - push\r\n\tX\r\n\tX\tRCS CMD - ON\r\n\tX\r\n\tXXXXXXXXXXXXXXXXXXXXXXXXXXX\r\n\t\t\t\t\t\t\t\t\tX\r\n00:11\t\tCanard deploy (auto)\tX CNRD DPLY pb - push\r\n\t\t\t\t\t\t\t\t\tX\r\n\t2\tC/W CSM - CM\t\t\t\tX\r\n\t\t\t\t\t\t\t\t\tX\r\n\t\t\t\t\t\t\t\t\tX\r\n\t3\tMASTER ALARM pb/lt - \t\tX\r\n\t\t\tpush\t\t\t\t\tX\r\n\t\t\t\t\t\t\t\t\tX\r\n\t\t\t\t\t\t\t\t\tX\r\n00:14\t\tELS logic arm (auto)\tX ELS LOGIC - on (up)\r\n\t\t\t\t\t\t\t\t\tX\r\n24K'\t\tLES TWR jett (auto)\t\tX\r\n\t\t\t\t\t\t\t\t\tX\r\n\t\ta.\tDocking ring sep\t\tX CSM/LM FNL SEP\r\n\t\t\t\t\t\t\t\t\tX\t(both) - on (up)\r\n\t\t\t\t\t\t\t\t\tX\r\n\t\tb.\tTWR attach nuts\t\tX TWR JETT\r\n\t\t\tdetonate\t\t\t\tX\t(both) - on (up)\r\n\t\t\t\t\t\t\t\t\tX\r\n\t\tc.\tSCS RCS disable\t\t\tX RCS CMD - OFF\r\n\t\t\t\t\t\t\t\t\tX\r\n\t\td.\tTWR jett mot fire\t\tX\r\n\t\t\t\t\t\t\t\t\tX\r\n\t\tApex cover jett (auto)\t\tX APEX COVER JETT\r\n\t\t\t\t\t\t\t\t\tX\tpb - push\r\n\t\t\t\t\t\t\t\t\tX\r\n\t\tDrogue chutes deploy\t\tX DROG DPLY pb - push\r\n\t\t\t(auto)\t\t\t\t\tX\t(2 sec after\r\n\t\t\t\t\t\t\t\t\tX\tapex cover jett)\r\n\t\t\t\t\t\t\t\t\tX\r\n23.5K'\t4 \tMon CAB PRESS ind -\tX If not incr by 17K'\r\n\t\t\tstarts incr\t\t\t\tX\trh CAB PRESS\r\n\t\t\t\t\t\t\t\t\tX\t\tRELF vlv -\r\n\t\t\t\t\t\t\t\t\tX\t\tDUMP (safety\r\n\t\t\t\t\t\t\t\t\tX\t\tlatch off)\r\n\t\t\t\t\t\t\t\t\tX If still no incr\r\n\t\t\t\t\t\t\t\t\tX\tCAB PRESS DUMP\r\n\t\t\t\t\t\t\t\t\tX\t vlv - open\r\n\t\t\t\t\t\t\t\t\tX\t (CCW)\r\n\t\t\t\t\t\t\t\t\tX\r\n10K'\t\tMn chutes & VHF\t\tX\r\n\t\t\trecovery ant deploy\t\tX\r\n\t\t\t(auto)\t\t\t\t\tX\r\n\t\t\t\t\t\t\t\t\tX\r\n\t5\tMN DPLY pb - push\t\t\tX\r\n\t\t\t(within 1 sec)\t\t\tX\r\n\t\t\t\t\t\t\t\t\tX\r\n\t\t\tCAUTION\t\t\t\t\tX\r\n\t\t\t\t\t\t\t\t\tX\r\n\t\tCM PRPLNT DUMP should\t\tX\r\n\t\tbe init immediately\t\t\tX\r\n\t\tafter mn chute dis-\t\t\tX\r\n\t\treefing. If mn or\t\t\tX\r\n\t\tpyro bus lost, use RHCs\t\tX\r\n\t\tfor burn, not CM PRPLNT\tX\r\n\t\tDUMP sw.\t\t\t\t\tX\r\n\t\t\t\t\t\t\t\t\tX\r\n\t6\tCAB PRESS RELF vlv (2)\t-\tX\r\n\t\t\tCLOSE (safety latch\t\tX If CAB PRESS DUMP\r\n\t\t\toff)\t\t\t\t\t\tX\tvlv used to\r\n\t\t\t\t\t\t\t\t\tX\tequalize ΔP, CAB\r\n\t\t\t\t\t\t\t\t\tX\tPRESS DUMP vlv -\r\n\t\t\t\t\t\t\t\t\tX\tclose (CW)\t\r\n\t\t\t\t\t\t\t\t\tX\r\n\t7\tCM PRPLNT DUMP - on (up)\tX\r\n\t\t\t(dump burn is audible)\tX\r\n\t\t\t\t\t\t\t\t\tX\r\n\t8\tRCS IND sel - CM 1\t\t\tX RCS IND sel - CM 2\r\n\t\t\tCM RCS He PRESS ind -\tX CM RCS He PRESS\r\n\t\t\t decr\t\t\t\t\tX\tind - decr\r\n\t\t\t\t\t\t\t\t\tX\tIf not decr or\r\n\t\t\t\t\t\t\t\t\tX\tRCS jets not\r\n\t\t\t\t\t\t\t\t\tX\tfiring\r\n\t\t\t\t\t\t\t\t\tX\t\tRHC (both) -\r\n\t\t\t\t\t\t\t\t\tX\t\tFire all RCS\r\n\t\t\t\t\t\t\t\t\tX\t\tjets (except\r\n\t\t\t\t\t\t\t\t\tX\t\tplus pitch)\r\n\t\t\t\t\t\t\t\t\tX\t\tuntil\r\n\t\t\t\t\t\t\t\t\tX\t\tprplnts\r\n\t\t\t\t\t\t\t\t\tX\t\tare depleted\r\n\t\t\t\t\t\t\t\t\tX\r\n\t9\tSet up entry comm\t\t\tX\r\n\t\t\tVHF ANT - RECY\t\t\tX\r\n\t\t\tVHF AM A - SIMPLEX\t\tX\r\n\t\t\tVHF BCN - ON\t\t\tX\r\n\t\t\t\t\t\t\t\t\tX\r\n\t\tXmit voice\t\t\t\t\tX\r\n\t\t\t(VHF AM) reporting\t\tX\r\n\t\t\t Position\t\t\t\tX\r\n\t\t\t Mn chutes\t\t\t\tX\r\n\t\t\t  disreefed\t\t\t\tX\r\n\t\t\t Splash err\t\t\t\tX\r\n\t\t\t Crew status\t\t\tX\r\n\t\t\t\t\t\t\t\t\tX\r\n\t10\tCrew couch struts (4) -\t\tX\r\n\t\t\tunlock\t\t\t\t\tX\r\n\t\t\t\t\t\t\t\t\tX\r\n\t11\tGrd track determination\tX\r\n\t\t\t\t\t\t\t\t\tX\r\n\t\ta.\tKey V37E 21E\t\t\tX\r\n\t\t\t\t\t\t\t\t\tX\r\n\t\tb.\tFL V04 N06\t\t\t\tX\r\n\t\t\t Option code 00002\t\tX\r\n\t\t\t CMC assumed option\t\tX\r\n\t\t\t  0000X\t\t\t\t\tX\r\n\t\t\t   Verify\t\t\t\tX\r\n\t\t\t    R2 = 00001\t\t\tX\r\n\t\t\t     PRO\t\t\t\tX\r\n\t\t\t\t\t\t\t\t\tX\r\n\t\tc.\tFL V06 N34\t\t\t\tX\r\n\t\t\t Get Lat Long\t\t\tX\r\n\t\t\t   00XXX. HRS\t\t\tX\r\n\t\t\t   000XX. MIN\t\t\tX\r\n\t\t\t   0XX.XX SEC\t\t\tX\r\n\t\t\t\t\t\t\t\t\tX\r\n\t\t\tAccept\tPRO\t\t\t\tX\r\n\t\t\tReject\tKey V25E\t\tX\r\n\t\t\t\tLoad\t\t\t\tX\r\n\t\t\t\t desired\t\t\t\tX\r\n\t\t\t\t GET Lat\t\t\tX\r\n\t\t\t\t Long\t\t\t\tX\r\n\t\t\t\t\t\t\t\t\tX\r\n\t\td.\tFL V06 N43\t\t\t\tX\r\n\t\t\t Lat (+N)\t\t\t\tX\r\n\t\t\t  XXX.XX DEG\t\t\tX\r\n\t\t\t Long (+E)\t\t\t\tX\r\n\t\t\t  XXX.XX DEG\t\t\tX\r\n\t\t\t Alt XXX.X NM\t\t\tX\r\n\t\t\t\t\t\t\t\t\tX\r\n\t\t\t\t\t\t\t\t\tX\r\n\t12\tWhen prplnt dump burn\t\tX\r\n\t\t\tcompleted\t\t\t\tX\r\n\t\t\t CM PRPLNT PURG - on\tX\r\n\t\t\t  (up) (purge is\t\t\tX CM RCS He DUMP pb -\r\n\t\t\t   audible)\t\t\t\tX  push\r\n\t\t\t\t\t\t\t\t\tX If RHC (both) used\r\n\t\t\t\t\t\t\t\t\tX  for prplnt dump\r\n\t\t\t\t\t\t\t\t\tX  burn\r\n\t\t\t\t\t\t\t\t\tX\tRHC (both) -\r\n\t\t\t\t\t\t\t\t\tX\t Fire all jets\r\n\t\t\t\t\t\t\t\t\tX\t  (except plus pitch)\r\n\t\t\t\t\t\t\t\t\tX\r\n\t\t\t\t\t\t\t\t\tX\r\n\t13\tCAB PRESS RELF vlv (2)\t- \tX\r\n\t\t  BOOST/ENTR (safety\t\tX If CAB PRESS DUMP\r\n\t\t  latch off)\t\t\t\t\tX   vlv used to\r\n\t\t\t\t\t\t\t\t\tX   equalize ΔP, CAB\r\n\t\t\t\t\t\t\t\t\tX   PRESS DUMP vlv -\r\n\t\t\t\t\t\t\t\t\tX   open (CCW)\r\n\t\t\t\t\t\t\t\t\tX\r\n\t14\tcb FLT/PL BAT BUS A, B &\tX\r\n\t\t BAT C (3) - close\t\t\tX\r\n\t\t\t\t\t\t\t\t\tX\r\n\t15\tcb FLT/PL MNA - open\t\tX\r\n\t\t\t\t\t\t\t\t\tX\r\n\t16\tcb FLT/PL MNB - open\t\tX\r\n\t\t\t\t\t\t\t\t\tX\r\n\t17\tcb RAD HTRS OVLD\t\t\tX\r\n\t\t (2) - open\t\t\t\t\tX\r\n\t\t\t\t\t\t\t\t\tX\r\n\t18\tcb SPS PITCH (2) - open\t\tX\r\n\t\t\t\t\t\t\t\t\tX\r\n\t19\tcb SPS YAW (2) - open\t\tX\r\n\t\t\t\t\t\t\t\t\tX\r\n3K'\t20\trh CAB PRESS RELF vlv -\tX\r\n\t\t DUMP (safety latch\t\t\tX\r\n\t\t off)\t\t\t\t\t\tX\r\n\t\t\t\t\t\t\t\t\tX\r\n\t21\tFLOOD FIXED - POST LDG\tX\r\n\t\t\t\t\t\t\t\t\tX\r\n\t\t\t\t\t\t\t\t\tX\r\n\t\t\t\t\t\t\t\t\tX\r\n\t22\tFLOOD DIM - 1 or 2\t\t\tX\r\n\t\t\t\t\t\t\t\t\tX\r\n\t\t\t\t\t\t\t\t\tX\r\n\t\t\t\t\t\t\t\t\tX\r\n\t\t\t\t\t\t\t\t\tX\r\n800'\t23\tCAB PRESS RELF vlv (2)-X\r\n\t\t CLOSE (safety latch\t\tX If CAB PRESS DUMP\r\n\t\t\toff)\t\t\t\t\t\tX   vlv used to\r\n\t\t\t\t\t\t\t\t\tX   equalize ΔP, CAB\r\n\t\t\t\t\t\t\t\t\tX   PRESS DUMP vlv -\r\n\t\t\t\t\t\t\t\t\tX   close (CW)\r\n\t\t\t\t\t\t\t\t\tX\r\n\t24\tELS LOGIC - on (up)\t\t\tX\r\n\t\t\t(verify)\t\t\t\t\tX\r\n\t\t\t\t\t\t\t\t\tX\r\n\t25\tCM RCS PRPLNT (both) -\t\tX\r\n\t\t\tOFF\t\t\t\t\t\tX\r\n\t\t\t CM RCS PRPLNT tb\t\tX\r\n\t\t\t  (both) - bp\t\t\tX\r\n\t\t\t\t\t\t\t\t\tX\r\n\t26\tDIRECT O2 vlv - OPEN\t\tX\r\n\t\t\t(CCW)\t\t\t\t\tX\r\n\t\t\t\t\t\t\t\t\tX\r\n\t27\tMN BUS TIE (2) - OFF\t\tX\r\n\t\t\t\t\t\t\t\t\tX\r\n\t\t\tCAUTION\t\t\t\t\tX\r\n\t\t\t\t\t\t\t\t\tX\r\n\t\tMN BUS TIE sw must be\t\tX\r\n\t\tleft in OFF position\t\tX\r\n\t\tto ensure that bats\t\t\tX\r\n\t\tA, B, & C are used to\t\tX\r\n\t\tpwr postlanding sys\t\t\tX\r\n\t\tonly, & to prevent\t\t\tX\r\n\t\tbat shorting caused by\t\tX\r\n\t\twater entering CM\t\t\tX\r\n\t\tfeed-thru conn\t\t\t\tX\r\n\t\t\t\t\t\t\t\t\tX\r\n\t28\tcb BAT RLY BUS (2) -\t\tX\r\n\t\t\topen\t\t\t\t\tX\r\n\t\t\t\t\t\t\t\t\tX\r\n\t29\tPostlanding check\t\t\tX\r\n\n\n\n\n\n",
  "Steps": [],
  "Images": []
}