{
  "Spacecraft": 0,
  "ProjectName": "SystemsEPSFCPowerPlant",
  "Group": "SYSTEMS: EPS",
  "Name": "FC Power Plant",
  "Side": 1,
  "SortPriority": 40503020,
  "checklistText": "\t\tFC Power Plant Check\r\n\r\nPanel 3:\r\n\t\tFC HTRS (all) - on (up)\r\n\r\n\t\tFC REACS tb (all) - gray\r\n\t\tFC IND sel - 1, 2, 3\r\n\t\t\tFC H2 FLOW ind - 0.03-0.15 lb/hr\r\n\t\t\tFC O2 FLOW ind - 0.25-1.2 lb/hr\r\n\t\t\tFC SKIN TEMP ind - 390째-450째F\r\n\r\n\t\t\tFC COND EXH TEMP ind - 150째-175째F\r\n\t\t\tFC pH HI tb - gray\r\n\r\n\t\tFC RAD TEMP LO tb - gray\r\n\r\n\t\t\r\n",
  "Steps": [],
  "Images": []
}