{
  "Spacecraft": 0,
  "ProjectName": "AlignmentsGNP51",
  "Group": "G&N ALIGNMENTS",
  "Name": "(P51) IMU Orientation",
  "Side": 1,
  "SortPriority": 41401010,
  "checklistText": "(P51/P53) IMU Orientation Determination\r\n\r\n\tCMC - on (req)\r\n\tISS - on (req)\r\n\tSCS - on (desired)\r\n\r\nPanel 7:\r\n\tLOGIC 2/3 PWR - on (up) (req if no SCS)\r\n\tOpt - on (req, P51)\r\n\tCOAS - calib (req, P53)\r\n\tAtt Cont (req)\r\n\r\n\r\n\tTotal Att Disp (req)\r\n\r\nPanel 2, 140:\r\n\r\n\t1 Key V37E 51E/53E\r\n\r\n\t\tPoss PROG alarm\r\n\t\r\n\t2 FL V50 N25\r\n\t\t00015 (trgt acq)\r\n\r\n\ta. Desired att cont mode\r\n\r\n\t\tMnvr to acq tgts, if necessary\r\n\t\r\nPanel 2, 140:\r\n\t\tPRO\r\n\t\tIf P51 go to 3\r\n\t\tIf P53 go to 4\r\n\r\n\tor b. To coarse align IMU to SC axes\r\n\t\tENTR (when att acpt)\r\n\t\tV41 N22 (coarse align)\r\n\t\t\tR, P, Y\t\t000.00 DEG\r\n\t\t\tNO ATT lt - on, then out\r\n\t\t\t\tRecycle 2\r\n\r\n\t\t(R53, Sighting Mark Routine)\r\n\r\n\t3 FL V51 (please mrk)\r\n\r\nPanel 122:\r\n\tOPT ZERO - OFF\r\n\tOPT MODE - MAN\r\n\tCtr trgt in SXT\r\n\tMARK (on trgt), go to 6\r\n\r\n\t(R56, Alternate LOS Sighting Mark Routine)\r\n\r\nPanel 2, 140:\r\n\t4 FL V06 N94\r\n\t\tSA\t\t\tXXX.XX DEG\r\n\t\tTA\t\t\tXX.XXX DEG\r\n\r\n\tAccept\tPRO\r\n\tReject\tKey V24E\r\n\t\tLoad desired SA & TA\r\n\r\n\r\n\t5 FL V53 (please mrk)\r\n\t\tRHC - ctr trgt in COAS reticle\r\n\r\n\t\tENTR, go to 6\r\n\r\n\t6 FL V50 N25\r\n\t\t00016 (term mrks)\r\n\r\n\tAccept\tPRO\r\n\r\nPanel 122:\r\n\tReject\tIf P51, MARK REJ pb - push\r\n\t\tReturn to 3\r\n\r\n\r\nPanel 2, 140:\r\n\t\tIf P53, ENTR, return to 5\r\n\r\n\t7 FL V01 N71\r\n\t\tTrgt code\t\t000XX\r\n\r\n\t\tAccept\tPRO\r\n\t\t\r\n\r\n\t\t\tPoss OPR ERR\r\n\t\t\t\tRecycles disp\r\n\r\n\r\n\tReject\tKey V21E\r\n\t\tLoad trgt code\r\n\r\n\tFor trgt 2 (trgt code â‰  00)\r\n\t\tP51, return to 3\r\n\t\tP53, return to 4\r\n\r\n\t8 FL V06 N88 (planet only)\r\n\t\tX, Y, Z\t\t.XXXXX\r\n\r\n\t\tAccept\tPRO\r\n\t\tReject\tKey V25E\r\n\t\t\tLoad desired data\r\n\r\n\t\tFor trgt 2\r\n\t\t\tP51, return to 3\r\n\t\t\tP53, return to 4\r\n\r\n\t\t\t(R54, Sighting Data Display Routine)\r\n\r\n\t9 FL V06 N05\r\n\t\tSighting angle diff\tXXX.XX DEG\r\n\r\n\t\tAccept\tPRO\r\n\t\tReject\tKey V32E, return to 2\r\n\r\n\t10 FL V37\r\n\t\tKey XXE\r\n\r\n\t11 If P51 and no P52\r\n\t\tOpt Pwr Down\r\n\r\n\r\n\r\n\r\n\r\n\r\n\r\n\r\n",
  "Steps": [],
  "Images": []
}